expte_code,anio,edificio,caratula,fecha_ingreso,ultima_gestion,se_giro_a,tipo_tramite,fecha,etiqueta,resolucion,dependencia_actual
3339,2023,OTROS EDIFICIOS,Renovación del servicio de limpieza y desinfección de los tanques cisternas y elevados instalados en diversos edificios dependente de la CSJN -OC N°789 y 791/21,2025-02-19,Vino Ferrari y Silvina a consultar por el cambio de dos conectores en el edificio de: Villarino y Cuerpo Médico,No está en esta Dirección,CD,2025-05-29,PENDIENTE RESOLVER,NO,Subdirección de Infraestructura
3,1111,PALACIO - TALCAHUANO 550,""".....""",,Se redactó nota...,Dependencia,,,PENDIENTE RESOLVER,NO,
4110,2024,NOTI.Y SUBASTAS-JEAN JEAURES 545,"Renovación del servicio de mantenimiento integral, preventivos, correctivo y con atención diaria de la instalación termomecánica del edificio de la calle Jean Jaures 545 de CABA OC N°384/2023",2025-02-19,Vto. 28/2/2025,No está en esta Dirección,LP,,PENDIENTE RESOLVER,NO,Subdirección de Infraestructura
153624,2024,MORGUE -JUNIN 760,Servicio de mantenimiento preventivo y correctivo grupos electrógenos de morgue.,2025-02-19,($4.099.000 vTO. 31/3/2025,No está en esta Dirección,CD,2025-02-19,PENDIENTE RESOLVER,NO,Subdirección de Infraestructura
3660,2024,OTROS EDIFICIOS,Servicio de mantenimiento preventivo y correctivo de las electrobombas -diversos edificios,2025-02-19,Expte. 904/2025 con reso VTO. 31/3/2025 - Desde intendencia solicitaron la continuidad 5 meses,No está en esta Dirección,CD,2025-02-19,PENDIENTE RESOLVER,NO,Subdirección de Infraestructura
2084,2024,NOTI.Y SUBASTAS-JEAN JEAURES 545,Servicio de mantenimiento preventivo y correctivo de instalación fija contra incendio Jean Jaures 545,2025-02-19,Exp. 888/2025 con reso ($1.240.560) VTO. 31/3/2025 - Silvina Pujol solicitó la continuidad por el plazo de 4 meses con el mismo proveedor - Alberto Fortunato SRL-,No está en esta Dirección,CD,2025-02-19,PENDIENTE RESOLVER,NO,Subdirección de Infraestructura
1545,2023,OVD - LAVALLE 1250,"Renovación del servicio de limpieza integral de todo el edificio, Lavalle 1248/50 OVD",2025-06-27,Se rubricó el pliego,Subdirección de Contrataciones,LP,2025-11-19,FINALIZÓ PARA ESTE DIRECCIÓN,NO,Compras
6855,2023,VIAMONTE 1197 CABA,Renovación del servicio de limpieza integral Viamoente 1197 - Mandamientos,2025-02-19,Se solicitó el archivo- tramita por el 6288/2025 -,No está en esta Dirección,LP,2026-02-02,FINALIZÓ PARA ESTE DIRECCIÓN,NO,Archivo
7122,2023,ROQUE SAENZ PEÑA,Renovación del servicio de limpieza integral Av. Roque Saenz Peña 1190,2025-02-19,Se solicitó e archivo (tramita por el 6288/2025),No está en esta Dirección,LP,2026-02-02,PENDIENTE RESOLVER,NO,Subdirección de Infraestructura
331,2025,ROQUE SAENZ PEÑA,CONTINUIDAD del servicio de limpieza integral Av. Roque Saenz Peña 1190,2025-02-10,Nuevo valor mensual $1.365.625 - Presta conformidad DOMIN SERVICIOS GENERALES SRL por el plazo de 5 meses,Subdirección de Contrataciones,CD,2025-03-20,FINALIZÓ PARA ESTE DIRECCIÓN,299/2025,Subdirección de Contrataciones
333,2025,VIAMONTE 1197 CABA,CONTINUIDAD del servicio de limpieza integral Viamonte 1197,2025-02-10,se presta conformidad a la continuidad por 5 meses,Dirección de Administración,CD,2025-03-25,FINALIZÓ PARA ESTE DIRECCIÓN,296/2025,Dirección de Administración
334,2025,OVD - LAVALLE 1250,CONTINUIDAD del servicio de limpieza integral OVD,2025-02-10,"Reso 367/2025 continuidad por 5 meses con el mismo proveedor DISTRIBION SRL ($ 55.984.500,00.-mensual de $11.196.900,00)",En esta Dirección,CD,2025-03-31,FINALIZÓ PARA ESTE DIRECCIÓN,SI,SUBDIR. DE ADMIN. - DEPTO. DE CONTABILIDAD Y PRESUPUESTO
335,2025,ARCHIVO GENERAL - HIPÓLITO YRIGOYEN 2041/61,CONTINUIDAD del servicio de limpieza integral Hipólito Yrigoyen 2041/61,2025-02-10,RESO 368/25 - $13.356.600 mensual y total $66.783.000 ( Distribion SRL por 5 meses ) Abril a Agosto/25-,En esta Dirección,CD,2025-03-31,FINALIZÓ PARA ESTE DIRECCIÓN,SI,SUBDIR. DE ADMIN. - DEPTO. DE CONTABILIDAD Y PRESUPUESTO
5952,2024,VILLARINO 2010 - DEPÓSITO AUTOMOTORES/ ÁREA DE TALLERES/ARCHIVO GENERAL PJN,Renovación del servicio de limpieza integral Villarino 2010,2025-02-13,OC n° 241 y 242/2023 - VTO. 30/6/2025 (Esc prefetente despacho 205/25) Se solicitó la continuidad por 3 meses (jul/ago/sept) Correo AV,No está en esta Dirección,LP,2025-03-05,EN TRÁMITE PARA ESTA DIRECCIÓN,NO,Subdirección de Infraestructura
7355,2024,OVD - LAVALLE 1250,Renovación del servicio de mantenimiento integral preventivo y correctivo de los tres ascensores instalados en Lavalle 1429,2025-02-13,OC n° 2221 y 222/2023 - VTO. 30/6/2025 ESC preferente despacho 204/25,No está en esta Dirección,LP,,PENDIENTE RESOLVER,NO,Subdirección de Infraestructura
729,2025,OTROS EDIFICIOS,Gianini Alberto Luis s/ contratación de locación de servicio,2025-02-12,"RESO 1996/2025 - Autorizar al Director de la Dirección General de Gestión Interna e Infraestructura a suscribir el contrato de servicios con el arquitecto Alberto Luis Gianini (DNI 11.280.669), por el término de nueve(9) meses - ($ 2.017.219,89),",En esta Dirección,OTROS,2025-09-04,EN TRÁMITE PARA ESTA DIRECCIÓN,NO,DPTO. DE LIQUIDACIONES
322,2025,PALACIO - TALCAHUANO 550,CONTINUIDAD del servicio de mantenimiento preventivo y correctivo de los grupos electrógenos del sistema eléctrico informático y del sist. eléctrico general instalados en el Palacio OC 618/24,2025-03-07,se presta coformidad a lo actuado por Infra,Dirección de Administración,CD,2025-03-10,FINALIZÓ PARA ESTE DIRECCIÓN,NO,Subdirección de Infraestructura
5819,2024,PALACIO - TALCAHUANO 550,Contratación del servicio de mantenimietno integral preventivo y correctivo de los equipos acondicionadores de aire instalados en el Palacio 550 y Dpto. de medicina preventiva laboral Inmigrantes 1950 1° Piso,2025-05-19,RESOLUCION 831/25 ADJUDICA A TEKMIK por $243.300.000,Subdirección de Contrataciones,LP,2025-05-19,FINALIZÓ PARA ESTE DIRECCIÓN,831/25,MESA DE ENTRADAS
7778,2024,OTROS EDIFICIOS,CONTINUIDAD del servicio de limpieza y desinfección de los tanques cisterna y elevados instalados en diversos edificios dependientes de la CSJN OC 353/2024,2025-02-12,Resolución 92/25 BIO Efia Treatment SA $4.850.622 POR 6 MESES a partir de marzo/2025,Subdirección de Contrataciones,CD,2025-02-24,FINALIZÓ PARA ESTE DIRECCIÓN,SI,"SUBDIR. DE COMPRAS- OBR. PUBL, DAJuDeCyCO y EXPTES VS"
7757,2024,NOTI.Y SUBASTAS-JEAN JEAURES 545,"CONTINUIDAD del servicio de mantenimiento integra, preventivo, correctivo y con atención diaria de la instalación termomecánica del edificio Jean Jaures 545 OC 384/2023",2025-02-12,Con resolución n° 73/2025 TEKNIK SRL $21.696.655 / Mensual:$4.339.331) por 5 MESES a partir del 1/3/2025,Subdirección de Contrataciones,CD,2025-02-24,FINALIZÓ PARA ESTE DIRECCIÓN,SI,"SUBDIR. DE COMPRAS- OBR. PUBL, DAJuDeCyCO y EXPTES VS"
1533,2024,MORGUE -JUNIN 760,Renovación del servicio de mantenimiento preventivo y correcito AA Morgue,2025-02-19,(ESC 328/2025 -$14.523.000 OC vigente: N° 639/24 vto 30/04/2025 (Silvina Pujol pide la contiuindad por 4 meses),No está en esta Dirección,CD,2025-02-27,PENDIENTE RESOLVER,NO,Subdirección de Infraestructura
4111,2024,CUERPO DE PERITOS - BARTOLOMÉ MITRE 718/20,Renovación del servicio de mantenimiento termomecánica. Bartolomé Mitre 718,2025-02-19,vto 30/04/2025 -Silvina Pujol solicitó la PRÓRROGA (1 MES ),No está en esta Dirección,LP,2025-03-06,PENDIENTE RESOLVER,NO,Subdirección de Infraestructura
3952,2023,CUERPO DE PERITOS - BARTOLOMÉ MITRE 718/20,(OBRA PÚBLICA) Adecuación y mantenimiento del servicio de la instalación termomecánica. Bartolomé Mitre 718,2024-12-18,vto 30/04/2025,En esta Dirección,LP,,PENDIENTE RESOLVER,NO,En esta Dirección
8063,2023,CUERPO DE PERITOS - BARTOLOMÉ MITRE 718/20,RENOVACIÓN del servicio integral preventivo y correctivo con atención diaria de la instalación termomecánica. Bartolomé Mitre 718,2024-12-18,OC.521/2023,En esta Dirección,LP,,PENDIENTE RESOLVER,NO,En esta Dirección
1534,2024,NOTI.Y SUBASTAS-JEAN JEAURES 545,"Renovación del servicio mantenimiento preventivo, correctivo de los ascensores de Hipólito Yrigoyen y Jean Jaures 545 OC 388/2023",2024-12-18,"$34.800.000. En Infra ""para que ratifiquen o rectifiquen lo realizado por intendencia""",No está en esta Dirección,LP,2025-02-25,PENDIENTE RESOLVER,NO,Subdirección de Infaestructura
2083,2024,OVD - LAVALLE 1250,Renovación del servicio de mantenimiento peventivo y correctivo AA OVD (OC 364/2023),2024-12-18,$22.800.000,No está en esta Dirección,CD,,PENDIENTE RESOLVER,NO,Subdirección de Infaestructura
4888,2024,OTROS EDIFICIOS,Renovación : Desratización diversos edificios (Anterior expte. 2267/2023),2025-02-20,15/08/2024 pase a Indendencia para renovación para licitacion,Subdirección de Infraestructura,LP,2025-02-19,PENDIENTE RESOLVER,NO,Subdirección de Infaestructura
6798,2023,VILLARINO 2010 - DEPÓSITO AUTOMOTORES/ ÁREA DE TALLERES/ARCHIVO GENERAL PJN,Cubierta techo Villarino 2010,2025-02-19,($6.000.000 1 presupuesto hispomterica Vto. 27/4/24),No está en esta Dirección,CD,,PENDIENTE RESOLVER,NO,Subdirección de Infaestructura
2944,2023,MORGUE -JUNIN 760,"Adecuación, provisión, instalación y certif, sistema hidrantes del edificio Morgue - Convenio UTN",2025-02-19,($4.850.000 -Interadministrativo- pendiente prestar conformidad por Infra (Obra Pública vinculación),No está en esta Dirección,CD,,PENDIENTE RESOLVER,NO,Subdirección de Infaestructura
2411,2024,OTROS EDIFICIOS,Provisión e instalación de estanterías metálicas para archivos Inmigrantes 1950,2025-02-20,Resolución ok al LLAMADO 2667/2024,No está en esta Dirección,LP,,FINALIZÓ PARA ESTE DIRECCIÓN,SI,SUBDIR. DE ADMIN. - DEPTO. DE CONTABILIDAD Y PRESUPUESTO
5658,2024,MORGUE -JUNIN 760,Contratación del Anteproyecto Integral y Pliego para la readecuación y refuncionalización de la Morgue Judicial,2025-02-20,"Nueva fecha de apertura 16/04/2025 - $534.611.197,25",Subdirección de contrataciones,LP,2025-03-14,PENDIENTE RESOLVER,SI,Mesa Dirección
8326,2024,MORGUE -JUNIN 760,"Provisión de ""mobiliario"" - ($3.684.000) Sillas morgue judicial,OVD, cuerpo médico . PET .",2025-02-20,Desde Infra van a incorporar la solicitud a un nuevo llamado de LP,Subdirección de Infraestructura,CD,,FINALIZÓ PARA ESTE DIRECCIÓN,SI,Subdirección de Infraestructura
5377,2024,PALACIO - TALCAHUANO 550,Consolidación y mantenimiento de las fachadas del Palacio - Talcahuano 550,2025-02-20,"Esc 2731/2025 . Mediante Reso 3399/2025 : Designar a la Arquitecta Delfina Apaolaza como Inspector de Obra de los trabajos de “Consolidación y Mantenimiento de fachadas Talcahuano y Tucumán y obras complementarias - Palacio de Justicia de la Nación, Talcahuano 550, C.A.B.A.”; en el marco de lo establecido por el artículo 37º de las Cláusulas Especiales del Pliego de Bases y Condiciones y de acuerdo a lo establecido por el artículo 28º de la ley 13.064.",No está en esta Dirección,LP,2025-12-23,FINALIZÓ PARA ESTE DIRECCIÓN,,INFRAESTRCUTURA
5225,2023,PALACIO - TALCAHUANO 550,Refuerzo estructura parcial de la azotea 7° Piso - (Etapa III-Modulos),2025-02-20,"Nueva fecha de apertura 10/04/2025 ($421.517.454) , por falta de firma en partida presupuestaria.",Subdirección de contrataciones,LP,2025-03-14,PENDIENTE RESOLVER,SI,MESA DIRECCIÓN
7552,2023,PALACIO - TALCAHUANO 550,Restauracion fachadas de patios interiores 3 y 4 obras complementarias- Lic 272/2023- (Exp 3907/2022),2025-02-20,"RESO 2252/2025 - Designar al Arquitecto Federico LOBOS como Supervisor de Obra de los trabajos de Restauración de fachadas de patios interiores 3 y 4 y obras complementarias del Palacio de Justicia (Etapa VI), Talcahuano 550, C.A.B.A.-",Subdirección de Contrataciones,LP,2025-09-30,PENDIENTE RESOLVER,SI,Mesa dirección
4994,2023,PALACIO - TALCAHUANO 550,RENOVACION DEL SERVICIO DE MANTENIMIENTO INTEGRAL PREVENTIVO Y CORRECIVO DE LOS ASCENSORES 1 A 12 Y LOS DENOMINADOS A Y B INSTALADOS EN EL EDIFICIO SEDE DE LA CSJN DE LA CABA - OC N° 73/2022,2024-11-05,RESOLUCIÓN 305/2025 Adjudicación ASCENSORES LA PLATA SRL $371.899.800 ($27.140.000) los primeros 6 meses y $34.843.300 los restantes 6 meses),No está en esta Dirección,LP,2025-03-25,FINALIZÓ PARA ESTE DIRECCIÓN,SI,SUBDIR. DE ADMIN. - DEPTO. DE CONTABILIDAD Y PRESUPUESTO
264,2024,PALACIO - TALCAHUANO 550,"SERVICIO DE ALQUILER DE LAS PROTECCIONES EN FACHADAS EXTERNAS DEL PALACIO DE JUSTICIA, TALCAHUANO 550, CABA DEL PALACIO DE JUSTIACIA DE LA NACION - LICITACION PUBLICA N° 180/2023 ( EXPEDIENTE N° 7168/2022 ) FRACASADA",2024-09-13,"RESOLUCIÓN 3167/2024 y 709/2025 ( Lic- n° 349 (18) meses, y adjudicar a la oferta n°3 - “ANDAMIOS NESTRADUÑOL S.R.L.$386.290.000)",No está en esta Dirección,LP,2025-05-13,FINALIZÓ PARA ESTE DIRECCIÓN,SI,SUBDIR. DE COMPRAS- GESTION DE PByC
3662,2024,PALACIO - TALCAHUANO 550,RENOVACION DEL SERVICIO DE CERTIFICACION REPARACIONES MANTENIMIENTO PREVIO PUESTA EN MARCHA Y CONSERVACION DEL SISTEMA DE CALEFACCION CENTRAL DEL PALACIO DE JUSTICIA SITO EN TALCAHUANO 550 DE LA CABA - OC N° 194/24,2025-05-20,Resolución 837/25 Adjudica a Teknik por la suma de $ 611.497.000,-,LP,2025-05-20,FINALIZÓ PARA ESTE DIRECCIÓN,837/25,Mesa de Entradas Administrativa
SN,2025,PALACIO - TALCAHUANO 550,Partida especial: alquiler de volquetes,2025-02-20,No se tramitará por PE- será a través de Tesorería de la Dirección - Avisé a Eugenia vía telefónica,Correo electrónico,OTROS,2025-02-24,EN TRÁMITE PARA ESTA DIRECCIÓN,NO,Correo electrónico Eugenia Firvida
948,2025,PALACIO - TALCAHUANO 550,Partida especial Pulido 4° piso,2025-02-21,Se modificó nota de elevación / se prestó conformidad ($18.500.000),Dirección de Administración CSJN,,2025-02-21,FINALIZÓ PARA ESTE DIRECCIÓN,NO,Dirección de la Administración
5077,2024,PALACIO - TALCAHUANO 550,"""Renovación de los seguros generales para distintos edificios dependientes de la CSJN - OC N°100 A 104/2024""",2025-09-06,"Caratulado como 1604/2025 - VINCULADO AL 5077/2024 $43.615.240,15 -Nación 1 año 1/5/2025-",Dirección de Administración,,2025-03-26,FINALIZÓ PARA ESTE DIRECCIÓN,NO,En esta Dirección
1031,2025,CUERPO MÉDICO FORENSE/OFICINA DE LA MUJER - LAVALLE 1429,"RENOV. DEL SERVICIO DE MANTENIMIENTO INTEGRAL ,PREVENTIVO Y CORRECTIVO DE LOS EQUIPOS ACONDICIONADORES DE AIRE INSTALADOS EN EL EDIFICIO DEL CUERPO MEDICO FORENSE SITO EN LAVALLE 1429 DE LA CIUDAD",2025-02-26,VER (recibimos el expte.) Vto. junio/2025,En esta Dirección,,2025-02-26,PENDIENTE RESOLVER,NO,En esta Dirección
SN,2025,PALACIO - TALCAHUANO 550,Llaves y mangueras de ajuste-,2025-02-26,Nota ok-Constancia de rendición en expediente 930/2025 - Liq 4243/2024 (Guillermina Sanchez),Correo electrónico a Guillermina Sanchez,,2025-02-27,FINALIZÓ PARA ESTE DIRECCIÓN,NO,Correo electrónico Guille Sanchez
SN,2025,NOTI.Y SUBASTAS-JEAN JEAURES 545,Arreglo de puerta Jean Jeaure 545,2025-02-28,Ver presupuestos -,Correo electrónico con Guillermina Sanchez,,,EN TRÁMITE PARA ESTA DIRECCIÓN,no,Correo electrónico con Guillermina Sanchez
989,2025,OTROS EDIFICIOS,“Renovación del servicio de desratización desinsectación y desinfección con destino al Palacio de Justicia de la Nación sito en calle Talcahuano 550 de la CABA OC Nn° 531 a 532/2023”,2025-02-28,En fecha 29/12/2025 se envía el PET y planilla de cotización en formato WORD- según lo solicitado por Guadalupe Cuello -,correo electrónico,,2025-12-29,FINALIZÓ PARA ESTE DIRECCIÓN,NO,Compras
7238,2024,PALACIO - TALCAHUANO 550,REPARACIÓN DEL GRUPO ELECTRÓGENO CATERPILLAR C32 DEL PALACIO DE JUSTICIA,2025-02-28,"Se redactó la nota de elevación con dos presupuestos de Finning ($ $ 48.992.931) y Tecnimotors ($ 62.827.774,55)",Dirección de Administración,,2025-03-20,EN TRÁMITE PARA ESTA DIRECCIÓN,NO,Subdirección de Infraestructura
1394,2025,PALACIO - TALCAHUANO 550,“Proceso: PINTURA DE ESPACIOS DE CIRCULACION DEL TERCER PISO DEL PALACIO DE JUSTICIA Y TAREAS COMPLEMENTARIAS”,2025-03-06,"Resolucion 566/2025 Codyar 13.866.348,75",No está en esta Dirección,,2025-04-24,FINALIZÓ PARA ESTE DIRECCIÓN,SI,Subdirección de Infraestructura
1893,2025,PALACIO - TALCAHUANO 550,"“Proceso: INSTALACIÓN DE CABLEADO ELÉCTRICO, COLOCACIÓN DE ARTEFACTOS DE ILUMINACIÓN EXISTENTES Y NUEVOS, INCLUYENDO MATERIALES Y MANO DE OBRA ESPECIALIZADA EN ESPACIOS COMUNES DEL PALACIO DE JUSTICIA",2025-03-06,Con Reso 557/2025 “JM SERVICIOS LOGISTICOS S.R.L.” por la suma total de $16.228.000,No está en esta Dirección,,2025-04-23,FINALIZÓ PARA ESTE DIRECCIÓN,SI,Subdirección de Infraestrucutra CSJN
2131,2025,PALACIO - TALCAHUANO 550,"“Proceso: RETIRO DE PARTES FLOJAS Y TRATAMIENTO DE HIERROS EXPUESTOS EN DINTELES DE VENTANAS DEL EDIFICIO UBICADO EN VILLARINO 2010, CABA, Y TRABAJOS COMPLEMENTARIOS",2025-03-06,resolución 619/25,En Infraestructura,,2025-05-05,FINALIZÓ PARA ESTE DIRECCIÓN,619/25,MESA DE ENTRADAS AMINISTRATIVA - CSJN
8054,2024,PALACIO - TALCAHUANO 550,"""ALQUILER DE GRUPO ELECTROGENO PARA EL PALACIO DE JUSTICIA DE LA NACIÓN""",2024-12-27,Ya tiene resolución,No está en esta Dirección,,,FINALIZÓ PARA ESTE DIRECCIÓN,SI 3706/2024,No está en esta Dirección
1111,2025,CUERPO DE PERITOS - BARTOLOMÉ MITRE 718/20,AIRE ACONDICIONADO PARA EL CUERPO DE PERITOS TASADORES DE LA JUSTICIA NACIONAL,2025-03-10,Solicitud que va a contemplar la Subdirección de Infraestructura - equipo de aire acondicionado -Cuerpo de Peritos Tasadores,Subdirección de Infeaestructura,,2025-03-11,FINALIZÓ PARA ESTE DIRECCIÓN,NO,Subdirección de Infraestructura
14322025,2025,OVD - LAVALLE 1250,S/N Baño OVD,2025-03-10,RESOLUCIÓN 288/2025 Coloret: $2.737.583,Correo electrónico Victoria Riobo,,2025-03-21,FINALIZÓ PARA ESTE DIRECCIÓN,SI,No está en esta Dirección
1296,2025,PALACIO - TALCAHUANO 550,"Pulido e hidrolaqueado 4042, 4043 y 4044",2025-03-11,Se presta conformidad a la solicitud de partida especial,Dirección de administración,,2025-03-19,EN TRÁMITE PARA ESTA DIRECCIÓN,no,DIRECCION DE ADMINISTRACION DE LA CSJN
1295,2025,PALACIO - TALCAHUANO 550,"Pulido e hidrolaqueado 4008, 4010, 4019 y 4020",2025-03-11,"Con resolución n° 263/2025 19-03-2025 , 9.110.900)",Dirección de administración,,2025-03-19,FINALIZÓ PARA ESTE DIRECCIÓN,SI,DIRECCION DE DESPACHO - DIRECTOR GENERAL - CPN JOSE C. ABRANCHI
812,2025,DaJuDeCO,ADQUISICION DE MOTORES DE VENTILACIÓN PARA AIRE ACONDICIONADO INSTALADO EN EL EDIFICIO DE LA DIRECCIÓN DE ASISTENCIA JUDICIAL EN DELITOS COMPLEJOS Y CRIMEN ORGANIZADO DEL PODER JUDICIAL DE LA NACIÓN,2025-03-12,Con resolución 265/2025,En esta Dirección,,2025-03-20,FINALIZÓ PARA ESTE DIRECCIÓN,SI,En esta Dirección
904,2025,OTROS EDIFICIOS,CONTINUIDAD DEL SERVICIO DE MANTENIMIENTO INTEGRAL PREVENTIVO Y CORRECTIVO DE LAS ELECTROBOMBAS INSTALADAS EN VARIOS EDIFICIOS DEPENDIENTES DE LA CSJN - OC N° 76/2024,2025-03-12,"Con resolución 240/2025 - “ACLIMA DE ESCOFE VICTOR DANIEL"" ($1.200.000 mensual y un total de pesos $6.000.000 seis millones) 5 meses a partir del vto. oc actual N° 76/24 )",Subdirección de la Administración,,2025-03-19,FINALIZÓ PARA ESTE DIRECCIÓN,SI,"SUBDIR. DE COMPRAS- OBR. PUBL, DAJuDeCyCO y EXPTES VS"
1340,2025,PALACIO - TALCAHUANO 550,"TRABAJOS DE PINTURA EN OFICINA 4008, 4010 Y 4020",2025-03-12,Se Solicita partida especial por $ 14.500.000,Subdirección de la Administración,,2025-03-18,FINALIZÓ PARA ESTE DIRECCIÓN,221/2025,Dirección de la Administración
888,2025,NOTI.Y SUBASTAS-JEAN JEAURES 545,CONTINUIDAD DEL SERVICIO DE MANTENIMIENTO PREVENTIVO DE LA INSTALACION FIJA CONTRA INCENDIOS UBICADA EN EL EDIFICIO SITO EN LA CALLE JEAN JUARES 545 Y AV. CORREINTES 3099 DE LA CIUDAD AUTONOMA DE BUENOS AIRES - OC N° 695/202,2025-03-12,"Resolución 239/2025: “ALBERTO FORTUNATO"" - total de ($ 1.026.000.) S.R.L $256.500 mensual / abril a julio 2025.",Subdirección de la Administración,,2025-03-19,FINALIZÓ PARA ESTE DIRECCIÓN,SI,"SUBDIR. DE COMPRAS- OBR. PUBL, DAJuDeCyCO y EXPTES VS"
1257,2025,PALACIO - TALCAHUANO 550,Continuidad alquiler grupo electrógeno,2025-03-17,Se presta conformidad a la continuidad por ser tecnicamente adminisble y economicamente conveniente,Dirección de Administración,,,FINALIZÓ PARA ESTE DIRECCIÓN,no,Dirección de Gestión
1417,2025,OTROS EDIFICIOS,PARTIDA ESPECIAL INSTITUTO GRIERSON -,2025-03-17,Tiene resolución 391/2025. Se presta conformidad a la continuidad del trámite $2.691.200 Flory Service. (Contratación directa),Dirección de Administración,,2025-04-08,FINALIZÓ PARA ESTE DIRECCIÓN,391/2025,Dirección de Administración
1432,2025,OVD - LAVALLE 1250,PARTIDA ESPECIAL P/TRABAJOS DE REPARACION DE BAÑOS DE USO PUBLICO UBICADO EN LA PLANTA BAJA DE LA OFICINA DE VIOLENCIA DOMESTICA LAVALLE 1250,2025-03-17,Se presta conformidad a la continuidad del trámite. Coloret $2.737.583,Dirección de Administración,,,FINALIZÓ PARA ESTE DIRECCIÓN,288/2025,Dirección de Administración
889,2025,MORGUE -JUNIN 760,COTINUIDAD MANTENIMIENTO GRUPO ELECTROGENO MORGUE JUDICIAL,2025-02-18,Resolución 317/2025 - grupo de emergencia de la Morgue - por el término de 4 meses- Fernandez Rimbau Maria Eugenia . por la suma de $ 330.600 mensual / y total de $1.322.400 ).,Dirección de Administración,,2025-03-25,FINALIZÓ PARA ESTE DIRECCIÓN,SI,MESA DE ENTRADAS ADMINISTRATIVA - CSJN
460,2025,MORGUE -JUNIN 760,ESC. - CONTRATACION DEL ANTEPROYECTO INTEGRAL Y PLIEGOS DE OBRA PUBLICA PARA LA READECUACION Y REFUNCIONALIZACION INTEGRAL DE LA MORGUE JUDICIAL SITA EN LAS CALLES JUNIN 760 Y VIAMONTE 2151 – C.A.B.A.,2025-02-20,Se aclara - no contempla UTE / Consorcios,Subdirección de Contrataciones,,2025-03-20,FINALIZÓ PARA ESTE DIRECCIÓN,no,DGIeI
1257,2025,PALACIO - TALCAHUANO 550,CONTINUIDAD DEL SERVICIO DE ALQUILER DE GRUPO ELECTROGENO PARA EL PALACIO DE JUSTICIA DE LA NACIÓN,2025-03-17,Presta conformidad - continuidad $12.608.200 (2 meses),No esta en esta Dirección,,,FINALIZÓ PARA ESTE DIRECCIÓN,293/2025,Contabilidad
1507,2025,PALACIO - TALCAHUANO 550,CONTINUIDAD DEL SERVICIO DE MANTENIMIENTO INTEGRAL PREVENTIVO Y CORRECIVO DE LOS ASCENSORES 1 A 12 Y LOS DENOMINADOS A Y B INSTALADOS EN EL EDIFICIO SEDE DE LA CSJN DE LA CABA - OC N° 693/2024,2025-03-25,"Con RESO 324/2025 .Presta conformidad a la continuidad- idéntico proveedor Ascensores La Plata S.R.L., 1 mes $16.892.460",Subdirección de Contrataciones,,2025-03-27,FINALIZÓ PARA ESTE DIRECCIÓN,SI,"SUBDIR. DE COMPRAS- OBR. PUBL, DAJuDeCyCO y EXPTES VS"
1525,2025,PALACIO - TALCAHUANO 550,SERVICIO DE ASESORAMIENTO PARA LA FUTURA CERTIFICACIÓN COMO ÁREA CARDIOPROTEGIDA DEL PALACIO DE JUSTICIA DE LA NACIÓN,2025-03-25,Con reso 325/2025 Se presta conformidad a la solicitud de partida especial por la suma de $ 2.800.000,,,2025-03-27,PENDIENTE RESOLVER,SI,SUBDIR. DE ADMIN. - DEPTO. DE LIQUIDACIONES
1604,2025,PALACIO - TALCAHUANO 550,RENOVACION DE LOS SEGUROS GENERALES PARA DISTINTOS EDIFICIOS DEPENDIENTES DE LA CSJN - ORDENES DE COMPRA N° 100 A 104/2024,2025-03-25,"Reso 601/2025: “NACION SEGUROS S.A.” los seguros generales para distintos edificios dependientes de la Corte Suprema de Justicia de la Nación por el término de doce (12) meses, al vto OC n° 100/24, 101/24, 102/24, 103/24 y 104/24, y hasta el 1/5/2026, por ($ 39.048.345,92.-)",En esta Dirección,,2025-04-28,FINALIZÓ PARA ESTE DIRECCIÓN,SI,SUBDIRECCIÓN DE CONTRATACIONES CSJN
1526,2025,OTROS EDIFICIOS,SERVICIO DE INTERNET Y TELEFONIA PARA SUBDIRECCIÓN DE SEGURIDAD,2025-03-26,"Con reso 342/2025 .Se presta conformidad a la partida especial por la suma de $ 729.469,07",Dirección de Administración,,2025-03-28,FINALIZÓ PARA ESTE DIRECCIÓN,no,Dirección de Gestión
2372,2025,PALACIO - TALCAHUANO 550,"ANÁLISIS DE COMPOSICIÓN, GRANULOMETRÍA Y CARACTERÍSTICAS CUALITATIVAS Y CUANTITATIVAS DE MUESTRAS DE SOLADO GRANÍTICO",2025-05-07,"Tiene Reso 959/2025 Muestras:“INSTITUTO NACIONAL DE TECNOLOGÍA INDUSTRIAL CENTROS DE INVESTIGACIÓN”, por la suma total $3.900.480",Dirección de Administración,,2025-05-23,FINALIZÓ PARA ESTE DIRECCIÓN,SI,Dirección de despacho
1770,2025,PALACIO - TALCAHUANO 550,ZABATTA JOSE EDUARDO S/BONIFICACION POR ANTIGÜEDAD EN TITULO - LICENCIADO EN HIGIENE Y SEGURIDAD EN EL TRABAJO,2025-03-31,"Solicitud de inicio - vuelve el expte. requieren se indique donde surge la exigibilidad del ""título"":",En esta Dirección,,,PENDIENTE RESOLVER,no,En esta Dirección
1770,2025,PALACIO - TALCAHUANO 550,AUTORIZACION PARA USO DE CUÑO,2025-04-01,Se autoriza el uso del cuño medalla para la Dra. Soraya Hidalgo,En esta Dirección,,,FINALIZÓ PARA ESTE DIRECCIÓN,no,En esta Dirección
962,2025,PALACIO - TALCAHUANO 550,"Esc del expediente 5739/2024 . CSJN S/ actualizar el pliego de especificaciones técnicas, cómputo y análisis de precios y presupuesto de la obra: Restauración integral de las escaleras y cajas de escaleras denominadas 2, 8 y 10, refuerzo estructural y obras complementarias – Palacio de Justicia – Talcahuano 550 CABA",2025-04-07,Lo devolvieron a esta Dirección sin actuaciones -,En esta Dirección,,2025-04-14,PENDIENTE RESOLVER,no,En esta Dirección
2005,2025,OTROS EDIFICIOS,Traspaso del servicio de instalaciones fijas contra incendio a la Sub. de Seguridad CSJN,2025-04-08,Caratulado- (en Sub. de Seguridad),Dirección de Despacho,,2025-04-10,FINALIZÓ PARA ESTA DIRECCIÓN,no,SUBDIRECCIÓN DE SEGURIDAD
1217,2025,PALACIO - TALCAHUANO 550,Continuidad servicio de Limpieza Palacio Talcahuano 550 y Villarino,2025-04-09,"Se solicitó la continuidad del servicio con idéntico prestador por el término de 3 meses , desde Compras van a solicitar una nueva cotización",Subdirección de Contrataciones CSJN,,,FINALIZÓ PARA ESTE DIRECCIÓN,NO,Subdirección de Contrataciones CSJN
